{
  "$schema": "https://json-schema.org/draft/2020-12/schema",
  "$id": "https://github.com/Tamircohen28/scaffold-gold/core/capabilities/schema.json",
  "title": "Platform capability registry",
  "description": "Machine-readable statement of what each supported harness can actually do. The root entry is the PLATFORM (Claude, Codex, Cursor, Gemini, OpenCode); each platform carries one entry per runtime SURFACE it ships (CLI, desktop app, IDE extension), because install path and capabilities differ per surface and a single row per vendor cannot state both. Skills declare the capabilities they require and the ones they merely prefer; this registry is the only place that answers whether a given surface provides them. Every supported surface must carry an explicit entry for every capability key — an omitted key is a schema error, not an implied 'no', so a gap can never be hidden by silence. A surface nobody has measured is marked support 'unverified' and carries NO capabilities block at all: silence about an unmeasured surface is honest, invented 'unknown' rows are not.",
  "type": "object",
  "required": [
    "schema_version",
    "capability_definitions",
    "platforms"
  ],
  "additionalProperties": false,
  "properties": {
    "schema_version": {
      "type": "integer",
      "const": 2
    },
    "last_reviewed": {
      "type": "string",
      "pattern": "^[0-9]{4}-[0-9]{2}-[0-9]{2}$",
      "description": "Date this registry was last checked against the platforms it describes."
    },
    "capability_definitions": {
      "type": "object",
      "description": "One entry per capability key, defining what the capability means. The key set here is the contract; platform entries must cover exactly it.",
      "propertyNames": {
        "$ref": "#/$defs/capabilityKey"
      },
      "minProperties": 20,
      "additionalProperties": {
        "type": "object",
        "required": [
          "summary"
        ],
        "additionalProperties": false,
        "properties": {
          "summary": {
            "type": "string",
            "minLength": 1
          },
          "degradation": {
            "type": "string",
            "description": "What a skill should do when this capability is absent."
          }
        }
      }
    },
    "platforms": {
      "type": "object",
      "description": "One entry per platform vendor, keyed snake_case. Surfaces live underneath; docs/engineering/build-and-release/platform-targets.json is keyed by SURFACE id, not by these.",
      "minProperties": 1,
      "propertyNames": {
        "type": "string",
        "pattern": "^[a-z][a-z0-9_]*$"
      },
      "additionalProperties": {
        "$ref": "#/$defs/platform"
      }
    }
  },
  "$defs": {
    "capabilityKey": {
      "type": "string",
      "enum": [
        "skills",
        "skill_auto_invocation",
        "subagents",
        "parallel_subagents",
        "agent_teams",
        "hooks",
        "mcp",
        "statusline",
        "shell",
        "git",
        "github_cli",
        "background_tasks",
        "worktree_isolation",
        "plugin_marketplace",
        "extension_install",
        "slash_commands",
        "ask_user_question",
        "artifacts",
        "session_transcripts",
        "dynamic_workflows",
        "mods"
      ]
    },
    "status": {
      "type": "string",
      "description": "native = first-class platform feature. native-experimental = shipped but behind a flag or documented as unstable. partial = present with material limits, spelled out in notes. emulated = the framework builds it from lower-level primitives (usually shell + git). adapter = provided through a platform-specific translation layer rather than the canonical artifact. unsupported = verified absent; skills must degrade. unknown = not verified — treat as unsupported at runtime and never advertise it.",
      "enum": [
        "native",
        "native-experimental",
        "partial",
        "emulated",
        "adapter",
        "unsupported",
        "unknown"
      ]
    },
    "capabilityEntry": {
      "type": "object",
      "required": [
        "status"
      ],
      "additionalProperties": false,
      "properties": {
        "status": {
          "$ref": "#/$defs/status"
        },
        "since": {
          "type": "string",
          "description": "Version floor at which the capability became available on this platform.",
          "pattern": "^[0-9]+\\.[0-9]+(\\.[0-9]+)?([-+][0-9A-Za-z.-]+)?$"
        },
        "since_source": {
          "type": "string",
          "description": "Where the `since` version came from, required when `since` is ahead of the platform's validated_against in platform-targets.json. A version we have not run is a documentation claim, and it must name the document. Without this, a `since` copied from a neighbouring feature entry is indistinguishable from one that was established.",
          "minLength": 1
        },
        "validation": {
          "type": "string",
          "description": "Command that proves the status claim. Required for anything claimed as native or native-experimental — evidence over declarations.",
          "minLength": 1
        },
        "fallback": {
          "type": "string",
          "description": "What the framework does instead when this capability is not available here."
        },
        "notes": {
          "type": "string"
        },
        "last_verified": {
          "type": "string",
          "pattern": "^[0-9]{4}-[0-9]{2}-[0-9]{2}$",
          "description": "Date this specific row was last checked against the platform it describes. Enforced against a 90-day staleness SLA by scripts/check-capability-registry.sh — a row past the cutoff fails the build."
        }
      },
      "allOf": [
        {
          "$comment": "A native claim without a validation command is a declaration, not evidence.",
          "if": {
            "properties": {
              "status": {
                "enum": [
                  "native",
                  "native-experimental"
                ]
              }
            },
            "required": [
              "status"
            ]
          },
          "then": {
            "required": [
              "validation"
            ]
          }
        },
        {
          "$comment": "Anything short of native must say what happens instead.",
          "if": {
            "properties": {
              "status": {
                "enum": [
                  "partial",
                  "emulated",
                  "adapter",
                  "unsupported",
                  "unknown"
                ]
              }
            },
            "required": [
              "status"
            ]
          },
          "then": {
            "anyOf": [
              {
                "required": [
                  "fallback"
                ]
              },
              {
                "required": [
                  "notes"
                ]
              }
            ]
          }
        }
      ]
    },
    "surface": {
      "type": "object",
      "required": [
        "display_name",
        "kind",
        "support"
      ],
      "additionalProperties": false,
      "properties": {
        "display_name": {
          "type": "string",
          "minLength": 1
        },
        "kind": {
          "type": "string",
          "description": "What kind of surface this is. Distinguishes the terminal client from the desktop app and the editor extension, which are the same product but not the same install or the same capability set.",
          "enum": [
            "cli",
            "desktop",
            "ide",
            "web",
            "cloud"
          ]
        },
        "support": {
          "type": "string",
          "description": "supported = this repo installs and validates here, and the capabilities block is measured. unverified = a real surface of the platform that this repo has never exercised; it carries no capability claims at all and no consumer may treat it as a target.",
          "enum": [
            "supported",
            "unverified"
          ]
        },
        "unverified_reason": {
          "type": "string",
          "description": "Required when support is 'unverified': what is known, what was never measured, and why the sibling surface's results were not carried over.",
          "minLength": 1
        },
        "aliases": {
          "type": "array",
          "description": "Other spellings of this platform id that consumers may encounter (kebab-case, marketing names). Present so every consumer normalizes the same way instead of inventing its own mapping.",
          "items": {
            "type": "string",
            "minLength": 1
          },
          "uniqueItems": true
        },
        "doc_urls": {
          "type": "array",
          "description": "Authoritative upstream documentation for this platform. Kept in sync with the doc_urls array in docs/engineering/build-and-release/platform-targets.json; consumers such as platform-sync should prefer this over their own bundled URL lists.",
          "items": {
            "type": "string",
            "format": "uri"
          },
          "uniqueItems": true
        },
        "runtime_surface_of": {
          "type": "string",
          "description": "Set when this target is a runtime surface of another adapter rather than a distinct distribution format (Claude Desktop consumes the Claude Code plugin)."
        },
        "install": {
          "type": "object",
          "required": [
            "type"
          ],
          "additionalProperties": false,
          "properties": {
            "type": {
              "type": "string",
              "enum": [
                "marketplace",
                "extension",
                "plugin-dir",
                "path",
                "symlink",
                "manual"
              ]
            },
            "command": {
              "type": "string"
            },
            "doc": {
              "type": "string",
              "description": "Repo-relative install guide."
            }
          }
        },
        "validation": {
          "type": "object",
          "required": [
            "command"
          ],
          "additionalProperties": false,
          "properties": {
            "command": {
              "type": "string",
              "minLength": 1
            },
            "requires_cli": {
              "type": "boolean",
              "default": true
            }
          }
        },
        "capabilities": {
          "type": "object",
          "description": "Every capability key must be present. Use status 'unknown' for anything unverified rather than omitting it.",
          "minProperties": 21,
          "maxProperties": 21,
          "propertyNames": {
            "$ref": "#/$defs/capabilityKey"
          },
          "additionalProperties": {
            "$ref": "#/$defs/capabilityEntry"
          }
        }
      },
      "description": "One runtime surface of a platform — the thing a user actually installs into.",
      "allOf": [
        {
          "$comment": "A surface this repo claims to support must say how it installs, how that is proven, and what it can do.",
          "if": {
            "properties": {
              "support": {
                "const": "supported"
              }
            },
            "required": [
              "support"
            ]
          },
          "then": {
            "required": [
              "install",
              "validation",
              "capabilities"
            ]
          }
        },
        {
          "$comment": "An unverified surface states why, and claims nothing. Capability rows here would be fabricated evidence.",
          "if": {
            "properties": {
              "support": {
                "const": "unverified"
              }
            },
            "required": [
              "support"
            ]
          },
          "then": {
            "required": [
              "unverified_reason"
            ],
            "not": {
              "anyOf": [
                {
                  "required": [
                    "capabilities"
                  ]
                },
                {
                  "required": [
                    "install"
                  ]
                }
              ]
            }
          }
        }
      ]
    },
    "platform": {
      "type": "object",
      "description": "A platform vendor and the surfaces it ships.",
      "required": [
        "display_name",
        "primary_surface",
        "surfaces"
      ],
      "additionalProperties": false,
      "properties": {
        "display_name": {
          "type": "string",
          "minLength": 1,
          "description": "The platform as a user names it — 'Claude', not 'Claude Code'. Surface-level display_name carries the specific one."
        },
        "vendor": {
          "type": "string",
          "minLength": 1,
          "description": "Organisation shipping the platform."
        },
        "aliases": {
          "type": "array",
          "items": {
            "type": "string",
            "minLength": 1
          },
          "uniqueItems": true,
          "description": "Other spellings of the PLATFORM id. Surface ids carry their own."
        },
        "doc_urls": {
          "type": "array",
          "items": {
            "type": "string",
            "format": "uri"
          },
          "uniqueItems": true,
          "description": "Authoritative upstream docs across the platform's surfaces."
        },
        "primary_surface": {
          "type": "string",
          "pattern": "^[a-z][a-z0-9_]*$",
          "description": "The surface this repo treats as the platform's reference install. Must be a key of surfaces, and must be a supported one."
        },
        "surfaces": {
          "type": "object",
          "description": "One entry per runtime surface. A platform with exactly one known surface still uses this map — the shape does not change when a second surface appears.",
          "minProperties": 1,
          "propertyNames": {
            "type": "string",
            "pattern": "^[a-z][a-z0-9_]*$"
          },
          "additionalProperties": {
            "$ref": "#/$defs/surface"
          }
        }
      }
    }
  }
}
