{
  "schema_version": 2,
  "last_reviewed": "2026-09-08",
  "capability_definitions": {
    "skills": {
      "summary": "Discovers and loads SKILL.md files shipped by this repo.",
      "degradation": "None possible \u2014 a target without skills is not a supported target."
    },
    "skill_auto_invocation": {
      "summary": "Selects a skill from its description without the user naming it.",
      "degradation": "Document the explicit invocation form (slash command or 'use the X skill') in the install guide."
    },
    "subagents": {
      "summary": "Delegates a bounded task to a separate agent with its own context.",
      "degradation": "Run the role inline in the main session, sequentially, with a narrowed scope."
    },
    "parallel_subagents": {
      "summary": "Runs two or more subagents concurrently.",
      "degradation": "Fan out sequentially; the task graph still holds, only wall-clock time changes."
    },
    "agent_teams": {
      "summary": "Long-lived named agents that message each other during a session.",
      "degradation": "Use one-shot subagents plus files under session-files/ as the message bus."
    },
    "hooks": {
      "summary": "Runs THIS REPO'S declared hook scripts on that platform's lifecycle events. Like every row here, this describes this repo's artifacts on that platform, not the platform's abstract feature set: the question is 'if I install this plugin there, do my hooks run?', not 'is that product hooks-capable?'",
      "degradation": "Move the guard into the skill body as an explicit step, and into CI as a check."
    },
    "mcp": {
      "summary": "Connects Model Context Protocol servers declared by the repo.",
      "degradation": "Use the equivalent CLI (gh, curl) through the shell capability."
    },
    "statusline": {
      "summary": "Renders a repo-provided status line in the session chrome.",
      "degradation": "Purely cosmetic \u2014 omit it. Never make a skill depend on it."
    },
    "shell": {
      "summary": "Executes arbitrary shell commands in the workspace.",
      "degradation": "Emit the commands for the user to run and wait for pasted output."
    },
    "git": {
      "summary": "Git is on PATH and the workspace is a repository.",
      "degradation": "Skip branch/commit/worktree workflows; skills that need them declare git as required."
    },
    "github_cli": {
      "summary": "The gh CLI is installed and authenticated.",
      "degradation": "Optional feature dependency. Fall back to printing the PR/issue body for the user to file manually."
    },
    "background_tasks": {
      "summary": "Runs a long command detached and reports its exit later.",
      "degradation": "Run in the foreground with a bounded timeout."
    },
    "worktree_isolation": {
      "summary": "Each task gets its own git worktree so concurrent agents do not collide.",
      "degradation": "Single checkout, one task at a time; the orchestrator serializes writes."
    },
    "plugin_marketplace": {
      "summary": "Installs and updates this plugin from a hosted marketplace listing.",
      "degradation": "Document a direct install path (git clone plus a local plugin/extension link)."
    },
    "extension_install": {
      "summary": "Installs the repo directly as an extension from a git URL.",
      "degradation": "Use the platform's own install path; this is not a universal mechanism."
    },
    "slash_commands": {
      "summary": "Exposes repo-provided commands as /name.",
      "degradation": "Users invoke the skill by describing it in prose."
    },
    "ask_user_question": {
      "summary": "Presents a structured multiple-choice question mid-run.",
      "degradation": "Ask in prose and stop for a free-text reply."
    },
    "artifacts": {
      "summary": "Publishes a rendered HTML/Markdown page as a shareable artifact.",
      "degradation": "Write the same content to a file in the repo and tell the user the path."
    },
    "session_transcripts": {
      "summary": "Session history is readable on disk in a documented format.",
      "degradation": "Usage analytics (session-report) are unavailable; say so rather than reporting zeros."
    }
  },
  "platforms": {
    "claude": {
      "display_name": "Claude",
      "vendor": "Anthropic",
      "aliases": [
        "anthropic"
      ],
      "primary_surface": "claude_code",
      "doc_urls": [
        "https://code.claude.com/docs/en/plugin-marketplaces",
        "https://code.claude.com/docs/en/plugins-reference",
        "https://code.claude.com/docs/en/skills"
      ],
      "surfaces": {
        "claude_code": {
          "display_name": "Claude Code",
          "kind": "cli",
          "support": "supported",
          "aliases": [
            "claude-code"
          ],
          "doc_urls": [
            "https://code.claude.com/docs/en/plugins-reference",
            "https://code.claude.com/docs/en/plugin-marketplaces",
            "https://code.claude.com/docs/en/skills"
          ],
          "install": {
            "type": "manual",
            "command": "git clone https://github.com/Tamircohen28/scaffold-gold.git && cd scaffold-gold",
            "doc": "docs/user/install/claude-code.md"
          },
          "validation": {
            "command": "test -d .claude/skills && ls .claude/skills/*/SKILL.md >/dev/null 2>&1"
          },
          "capabilities": {
            "skills": {
              "status": "native",
              "since": "2.0.0",
              "validation": "ls .claude/skills/*/SKILL.md >/dev/null 2>&1",
              "notes": "App-gold ships no plugin manifest. Claude Code discovers project-level skills directly from .claude/skills/ with no manifest required \u2014 this is the documented project-skills path, distinct from the plugin-install path used by plugin-gold repos. Validation checks that path directly instead of `claude plugin validate .`, which requires a .claude-plugin/plugin.json this repo shape does not ship."
            },
            "skill_auto_invocation": {
              "status": "native",
              "since": "2.0.0",
              "validation": "ls .claude/skills/*/SKILL.md >/dev/null 2>&1",
              "notes": "Description-driven selection over the same project-level .claude/skills/ tree; suppressed per skill with disable-model-invocation. Same non-plugin discovery path as skills, above."
            },
            "subagents": {
              "status": "native",
              "since": "2.0.0",
              "validation": "ls .claude/agents/*.md >/dev/null 2>&1",
              "notes": "Claude Code's documented project-level subagent path is .claude/agents/*.md, discovered with no plugin manifest required \u2014 the same non-plugin convention as .claude/skills/, not the root agents/ directory this repo's own .claude-plugin/plugin.json points `agents` at (that field exists only for the plugin-install route, which app-gold does not use). `claude plugin validate .` is dropped because it requires a .claude-plugin/plugin.json this repo shape does not and should not ship."
            },
            "parallel_subagents": {
              "status": "native",
              "since": "2.0.0",
              "validation": "command -v claude",
              "notes": "Multiple Agent calls in one message run concurrently. This is a Claude Code session behaviour, not something this repo's shape gates, so validation only proves the CLI is present rather than requiring a plugin manifest that has nothing to do with the claim."
            },
            "agent_teams": {
              "status": "native-experimental",
              "validation": "command -v claude",
              "notes": "Teammate messaging is available but documented as evolving; skills must not require it. Session behaviour, not gated by this repo's shape \u2014 validation proves the CLI is present rather than requiring a plugin manifest unrelated to the claim."
            },
            "hooks": {
              "status": "native",
              "since": "2.0.0",
              "validation": "jq -e '.hooks.SessionStart | length > 0' .claude/settings.json",
              "notes": "App-gold has no plugin manifest, so hooks/hooks.json (the CLAUDE_PLUGIN_ROOT-relative plugin hook bundle) is not the applicable mechanism here. Claude Code's non-plugin, project-level hook convention is the `hooks` key of .claude/settings.json, which this repo ships with a minimal SessionStart entry."
            },
            "mcp": {
              "status": "native",
              "since": "2.0.0",
              "validation": "bash scripts/check-manifest-declares.sh .mcp.json mcpServers"
            },
            "statusline": {
              "status": "native",
              "since": "2.0.0",
              "validation": "echo '{}' | bash scripts/statusline.sh"
            },
            "shell": {
              "status": "native",
              "validation": "command -v bash"
            },
            "git": {
              "status": "native",
              "validation": "git rev-parse --is-inside-work-tree"
            },
            "github_cli": {
              "status": "native",
              "validation": "gh auth status",
              "notes": "Platform imposes no limit, but gh is an optional host dependency \u2014 presence is environment-dependent, so skills treat it as optional."
            },
            "background_tasks": {
              "status": "native",
              "validation": "command -v bash",
              "notes": "Bash tool supports detached execution with completion callback."
            },
            "worktree_isolation": {
              "status": "native",
              "since": "2.0.0",
              "validation": "bash hooks/worktree-create.sh --help",
              "notes": "Automated by the repo's worktree hooks; on other targets the same thing is emulated by hand."
            },
            "plugin_marketplace": {
              "status": "unsupported",